{"type":"config","name":"Optimize zellij-template-render 100-button render path","metricName":"render_p95_us","metricUnit":"µs","bestDirection":"lower"}
{"run":1,"commit":"9f30a4b","metric":659,"metrics":{"render_p50_us":496,"render_p99_us":821,"render_max_us":888,"render_worst_us":902,"benchmark_runs":3,"benchmark_iterations":1000},"status":"keep","description":"baseline 100-button render benchmark before renderer changes","timestamp":1785491298731,"segment":0,"confidence":null,"asi":{"hypothesis":"establish baseline for 100-button MiniJinja Flex render path"}}
{"run":2,"commit":"6a4cf33","metric":580,"metrics":{"render_p50_us":478,"render_p99_us":758,"render_max_us":840,"render_worst_us":862,"benchmark_runs":3,"benchmark_iterations":1000},"status":"keep","description":"skip Flex child clones when no overflow indicator exists","timestamp":1785491485149,"segment":0,"confidence":null,"asi":{"hypothesis":"Avoid cloning Flex children for the common no-OnOverflow path so layout builds less temporary tree data.","checks":"cargo test -p zellij-template-render --target x86_64-unknown-linux-gnu passed","benchmark_delta_us":-79}}
{"run":3,"commit":"9570795","metric":568,"metrics":{"render_p50_us":479,"render_p99_us":679,"render_max_us":851,"render_worst_us":864,"benchmark_runs":3,"benchmark_iterations":1000},"status":"keep","description":"measure visible text width without allocating plain strings","timestamp":1785491521669,"segment":0,"confidence":7.583333333333333,"asi":{"hypothesis":"Compute visible width in one pass and skip ANSI escapes without allocating a temporary plain String.","checks":"cargo test -p zellij-template-render --target x86_64-unknown-linux-gnu passed","benchmark_delta_us":-12}}
{"run":4,"commit":"9570795","metric":627,"metrics":{"render_p50_us":420,"render_p99_us":725,"render_max_us":771,"render_worst_us":796,"benchmark_runs":3,"benchmark_iterations":1000},"status":"discard","description":"use empty default cells and synthesize spaces only in final frame","timestamp":1785491552448,"segment":0,"confidence":3.0847457627118646,"asi":{"hypothesis":"Avoid allocating and cloning a one-character String for untouched blank cells.","rollback_reason":"Primary render_p95_us regressed from current best 568us to 627us despite better p50.","next_action_hint":"Look for width or layout scans that reduce p95 without changing cell blank representation."}}
{"run":5,"commit":"9570795","metric":639,"metrics":{"render_p50_us":475,"render_p99_us":793,"render_max_us":877,"render_worst_us":944,"benchmark_runs":3,"benchmark_iterations":1000},"status":"discard","description":"avoid Vec allocation for one-line natural text size","timestamp":1785491598079,"segment":0,"confidence":2.84375,"asi":{"hypothesis":"Fast-path single-line text sizing to avoid collecting split lines for labels and row text.","rollback_reason":"Primary render_p95_us regressed from current best 568us to 639us.","next_action_hint":"Single-line contains scans add more cost than the avoided Vec allocation on this path."}}
{"run":6,"commit":"106dc9a","metric":481,"metrics":{"render_p50_us":410,"render_p99_us":586,"render_max_us":729,"render_worst_us":826,"benchmark_runs":3,"benchmark_iterations":1000},"status":"keep","description":"blit clipped flex children without an intermediate canvas","timestamp":1785491697375,"segment":0,"confidence":5.014084507042254,"asi":{"hypothesis":"Avoid allocating a cropped Canvas for every visible Flex child by copying from a source offset during blit.","checks":"cargo test -p zellij-template-render --target x86_64-unknown-linux-gnu passed","benchmark_delta_us":-87,"note":"Also removed the now-unused crop helper and updated the clipping test to exercise blit_from."}}
{"run":7,"commit":"6df3b4c","metric":473,"metrics":{"render_p50_us":407,"render_p99_us":694,"render_max_us":745,"render_worst_us":949,"benchmark_runs":3,"benchmark_iterations":1000},"status":"keep","description":"fast-path plain ASCII text painting","timestamp":1785491745922,"segment":0,"confidence":3.152542372881356,"asi":{"hypothesis":"Plain printable ASCII text has one cell per byte, so text_canvas can skip ANSI and unicode-width state machines for that common case.","checks":"cargo test -p zellij-template-render --target x86_64-unknown-linux-gnu passed","benchmark_delta_us":-8,"tradeoff":"p99 and worst sample worsened but primary p95 improved and behavior remains generic for printable ASCII."}}
{"run":8,"commit":"6df3b4c","metric":564,"metrics":{"render_p50_us":417,"render_p99_us":699,"render_max_us":724,"render_worst_us":735,"benchmark_runs":3,"benchmark_iterations":1000},"status":"discard","description":"avoid final trim copy by stopping at the last non-space cell","timestamp":1785491785264,"segment":0,"confidence":3.152542372881356,"asi":{"hypothesis":"Build output lines only through the last non-space cell to avoid trim_end_matches plus to_string allocation.","rollback_reason":"Primary render_p95_us regressed from current best 473us to 564us.","next_action_hint":"The rposition scan costs more than trimming in this workload; avoid extra row scans."}}
{"run":9,"commit":"6df3b4c","metric":485,"metrics":{"render_p50_us":414,"render_p99_us":588,"render_max_us":764,"render_worst_us":782,"benchmark_runs":3,"benchmark_iterations":1000},"status":"discard","description":"parse Flex markers without collecting split fields","timestamp":1785491840770,"segment":0,"confidence":2.619718309859155,"asi":{"hypothesis":"Avoid allocating a Vec for Flex marker fields during template tree parsing.","rollback_reason":"Primary render_p95_us regressed from current best 473us to 485us.","next_action_hint":"Flex marker parsing is not the current p95 bottleneck, or the extra explicit checks offset the allocation removal."}}
{"run":10,"commit":"6df3b4c","metric":505,"metrics":{"render_p50_us":424,"render_p99_us":706,"render_max_us":763,"render_worst_us":765,"benchmark_runs":3,"benchmark_iterations":1000},"status":"discard","description":"skip Flex distribution when no child can grow or shrink","timestamp":1785491883490,"segment":0,"confidence":2.7761194029850746,"asi":{"hypothesis":"Track grow and shrink eligibility while sizing children so layout skips no-op distribution scans.","rollback_reason":"Primary render_p95_us regressed from current best 473us to 505us.","next_action_hint":"The extra flag bookkeeping costs more than the skipped no-op distribution scans."}}
{"run":11,"commit":"6df3b4c","metric":495,"metrics":{"render_p50_us":412,"render_p99_us":694,"render_max_us":743,"render_worst_us":761,"benchmark_runs":3,"benchmark_iterations":1000},"status":"discard","description":"accumulate natural Flex size without temporary vectors","timestamp":1785491932361,"segment":0,"confidence":2.6956521739130435,"asi":{"hypothesis":"Natural size only needs sums and max values, so it can avoid collecting child sizes into a Vec.","rollback_reason":"Primary render_p95_us regressed from current best 473us to 495us.","next_action_hint":"The iterator collect is not the limiting cost here; keep the clearer existing natural_size flow."}}
{"run":12,"commit":"6df3b4c","metric":491,"metrics":{"render_p50_us":418,"render_p99_us":673,"render_max_us":758,"render_worst_us":1139,"benchmark_runs":3,"benchmark_iterations":1000},"status":"discard","description":"pass button actions by reference into text painting","timestamp":1785491968712,"segment":0,"confidence":3.9157894736842107,"asi":{"hypothesis":"Avoid cloning the button action before text_canvas because hitbox cells already clone from the same source action.","rollback_reason":"Primary render_p95_us regressed from current best 473us to 491us and worst latency spiked.","next_action_hint":"Action clone count is not a useful target for this small Action payload; focus on canvas and string work."}}
{"run":13,"commit":"ce20814","metric":447,"metrics":{"render_p50_us":378,"render_p99_us":613,"render_max_us":667,"render_worst_us":732,"benchmark_runs":3,"benchmark_iterations":1000},"status":"keep","description":"store untouched canvas cells as empty text","timestamp":1785492004132,"segment":0,"confidence":3.6551724137931036,"asi":{"hypothesis":"After removing intermediate crop canvases, empty untouched cells avoid allocating and cloning space strings while final frame output still renders them as spaces.","checks":"cargo test -p zellij-template-render --target x86_64-unknown-linux-gnu passed","benchmark_delta_us":-26,"revisited":"Earlier empty-cell attempt regressed before blit_from; the result improved after the canvas copy path changed."}}
{"run":14,"commit":"ce20814","metric":497,"metrics":{"render_p50_us":386,"render_p99_us":609,"render_max_us":690,"render_worst_us":699,"benchmark_runs":3,"benchmark_iterations":1000},"status":"discard","description":"skip trailing blank cells during frame output","timestamp":1785492037777,"segment":0,"confidence":5.170731707317073,"asi":{"hypothesis":"With untouched cells stored as empty text, output can skip trailing blank cells instead of pushing spaces then trimming.","rollback_reason":"Primary render_p95_us regressed from current best 447us to 497us.","next_action_hint":"The extra reverse scan is not worth the reduced line build work."}}
{"run":15,"commit":"ce20814","metric":451,"metrics":{"render_p50_us":382,"render_p99_us":602,"render_max_us":667,"render_worst_us":680,"benchmark_runs":3,"benchmark_iterations":1000},"status":"discard","description":"truncate output lines in place after trimming spaces","timestamp":1785492067480,"segment":0,"confidence":4.608695652173913,"asi":{"hypothesis":"Avoid allocating a second String for trimmed output lines by truncating the built line in place.","rollback_reason":"Primary render_p95_us was 451us, slightly worse than current best 447us.","next_action_hint":"The extra allocation is not a stable p95 bottleneck after empty cells; try changes with larger structural savings."}}
{"run":16,"commit":"b21d387","metric":433,"metrics":{"render_p50_us":377,"render_p99_us":553,"render_max_us":647,"render_worst_us":680,"benchmark_runs":3,"benchmark_iterations":1000},"status":"keep","description":"preallocate frame output lines to row width","timestamp":1785492097000,"segment":0,"confidence":4.6,"asi":{"hypothesis":"Reserve each output line near the viewport width so final frame construction does fewer String reallocations.","checks":"cargo test -p zellij-template-render --target x86_64-unknown-linux-gnu passed","benchmark_delta_us":-14,"state_repair":"Reconstructed from commit message because the worktree had .auto/log.jsonl deleted after compaction."}}
{"run":1,"commit":"9d167dc","metric":402,"metrics":{"render_p50_us":364,"render_p99_us":537,"render_max_us":653,"render_worst_us":674,"benchmark_runs":3,"benchmark_iterations":1000},"status":"keep","description":"stream text lines directly while painting text canvases","timestamp":1785493640193,"segment":0,"confidence":null,"asi":{"hypothesis":"Avoid allocating a Vec of split text lines in text_canvas; iterate split lines directly while preserving text validation.","checks":"cargo test -p zellij-template-render --target x86_64-unknown-linux-gnu passed","benchmark_delta_us":-31,"best_before_us":433}}
{"run":2,"commit":"9d167dc","metric":404,"metrics":{"render_p50_us":367,"render_p99_us":420,"render_max_us":647,"render_worst_us":677,"benchmark_runs":3,"benchmark_iterations":1000},"status":"discard","description":"fold text validation into plain ASCII detection","timestamp":1785493731647,"segment":0,"confidence":null,"asi":{"hypothesis":"Validate each split line while detecting printable ASCII so text_canvas avoids a separate full-string validation pass.","rollback_reason":"Primary render_p95_us regressed slightly from current best 402us to 404us.","next_action_hint":"Keep the simpler direct split-line streaming; avoid extra helper branches in the plain text hot path."}}
{"run":3,"commit":"9d167dc","metric":452,"metrics":{"render_p50_us":368,"render_p99_us":580,"render_max_us":660,"render_worst_us":672,"benchmark_runs":3,"benchmark_iterations":1000},"status":"discard","description":"fast-path visible width for printable ASCII text","timestamp":1785493787065,"segment":0,"confidence":null,"asi":{"hypothesis":"Return byte length for visible_width when a text line is printable ASCII, avoiding char iteration and unicode-width lookup.","rollback_reason":"Primary render_p95_us regressed from current best 402us to 452us; the extra ASCII scan or branch cost outweighed the saved width lookup.","next_action_hint":"Do not add separate ASCII detection in visible_width; gains are already captured better in text painting."}}
{"run":4,"commit":"9d167dc","metric":482,"metrics":{"render_p50_us":372,"render_p99_us":676,"render_max_us":2495,"render_worst_us":5635,"benchmark_runs":3,"benchmark_iterations":1000},"status":"discard","description":"slice blit rows instead of checking each cell with get","timestamp":1785493859494,"segment":0,"confidence":null,"asi":{"hypothesis":"Slice target and source rows once in blit_from to avoid per-cell get/get_mut bounds checks.","rollback_reason":"Primary render_p95_us regressed from current best 402us to 482us, with catastrophic max/worst outliers.","next_action_hint":"Keep the simple get-based blit; slice setup and range handling likely costs more or hurts optimizer behavior."}}
{"run":5,"commit":"fc24bf4","metric":389,"metrics":{"render_p50_us":367,"render_p99_us":403,"render_max_us":587,"render_worst_us":656,"benchmark_runs":3,"benchmark_iterations":1000},"status":"keep","description":"lock action arena once while parsing button markers","timestamp":1785493954288,"segment":0,"confidence":0.8666666666666667,"asi":{"hypothesis":"Parse all Button action markers under one action arena lock instead of locking the mutex for every button.","checks":"cargo test -p zellij-template-render --target x86_64-unknown-linux-gnu passed","benchmark_delta_us":-13,"best_before_us":402}}
{"run":6,"commit":"1e77dc2","metric":376,"metrics":{"render_p50_us":352,"render_p99_us":394,"render_max_us":536,"render_worst_us":603,"benchmark_runs":3,"benchmark_iterations":1000},"status":"keep","description":"preallocate Button marker strings","timestamp":1785494054706,"segment":0,"confidence":1.2682926829268293,"asi":{"hypothesis":"Build Button markers with a preallocated String and write! instead of a format! call for every button.","checks":"cargo test -p zellij-template-render --target x86_64-unknown-linux-gnu passed","benchmark_delta_us":-13,"best_before_us":389,"note":"Uses only std::fmt::Write; no dependency or behavior change."}}
{"run":7,"commit":"1e77dc2","metric":393,"metrics":{"render_p50_us":352,"render_p99_us":579,"render_max_us":635,"render_worst_us":638,"benchmark_runs":3,"benchmark_iterations":1000},"status":"discard","description":"preallocate Flex and overflow marker strings","timestamp":1785494141110,"segment":0,"confidence":2,"asi":{"hypothesis":"Build Flex and OnOverflow markers with preallocated String buffers instead of format! calls.","rollback_reason":"Primary render_p95_us regressed from actual best 376us to 393us.","next_action_hint":"Keep Button marker preallocation only; Flex markers are fewer and manual assembly adds branch/code cost without p95 gain."}}
{"run":8,"commit":"196d645","metric":370,"metrics":{"render_p50_us":344,"render_p99_us":381,"render_max_us":417,"render_worst_us":568,"benchmark_runs":3,"benchmark_iterations":1000},"status":"keep","description":"parse Button markers with split_once","timestamp":1785494218502,"segment":0,"confidence":2.1333333333333333,"asi":{"hypothesis":"Use split_once for Button marker parsing to avoid a three-step split iterator and preserve malformed-marker checks.","checks":"cargo test -p zellij-template-render --target x86_64-unknown-linux-gnu passed","benchmark_delta_us":-6,"best_before_us":376}}
{"run":9,"commit":"196d645","metric":420,"metrics":{"render_p50_us":354,"render_p99_us":548,"render_max_us":635,"render_worst_us":637,"benchmark_runs":3,"benchmark_iterations":1000},"status":"discard","description":"preallocate action token strings","timestamp":1785494307002,"segment":0,"confidence":1.7777777777777777,"asi":{"hypothesis":"Build action token strings with preallocated String and write! instead of format! in each action helper call.","rollback_reason":"Primary render_p95_us regressed from actual best 370us to 420us.","next_action_hint":"Keep format! for short action tokens; manual String assembly hurts p95 here."}}
{"run":10,"commit":"8c20292","metric":364,"metrics":{"render_p50_us":343,"render_p99_us":411,"render_max_us":572,"render_worst_us":597,"benchmark_runs":3,"benchmark_iterations":1000},"status":"keep","description":"stream leaf natural size calculation","timestamp":1785494406589,"segment":0,"confidence":1.7272727272727273,"asi":{"hypothesis":"Compute leaf natural size by iterating split lines directly and remove the temporary Vec<&str> helper.","checks":"cargo test -p zellij-template-render --target x86_64-unknown-linux-gnu passed","benchmark_delta_us":-6,"best_before_us":370,"note":"This revisits the earlier natural-size allocation idea after text_canvas streaming changed the surrounding cost profile."}}
{"run":11,"commit":"8c20292","metric":371,"metrics":{"render_p50_us":346,"render_p99_us":430,"render_max_us":627,"render_worst_us":640,"benchmark_runs":3,"benchmark_iterations":1000},"status":"discard","description":"fold text validation into visible width scan","timestamp":1785494491237,"segment":0,"confidence":1.7272727272727273,"asi":{"hypothesis":"Remove the separate validate_text scan in leaf natural_size by checking tabs and carriage returns inside visible_width.","rollback_reason":"Primary render_p95_us regressed from actual best 364us to 371us.","next_action_hint":"Keep validate_text separate; extra Result flow and per-character checks hurt p95 more than the removed scan helps."}}
{"run":12,"commit":"8c20292","metric":363,"metrics":{"render_p50_us":344,"render_p99_us":440,"render_max_us":610,"render_worst_us":620,"benchmark_runs":3,"benchmark_iterations":1000},"status":"discard","description":"preallocate parse stack and button label buffers","timestamp":1785494584140,"segment":0,"confidence":1.853658536585366,"asi":{"hypothesis":"Reserve small parse buffers for stack, root nodes, and button labels to reduce Vec/String growth during marker parsing.","rollback_reason":"Primary improved by only 1us versus actual best 364us, while p99/max/worst regressed and the fixed capacities risk overfitting the 100-button workload.","next_action_hint":"Avoid benchmark-shaped capacity constants unless repeated runs show a stable tail improvement or the capacity derives from input structure."}}
{"run":13,"commit":"8c20292","metric":460,"metrics":{"render_p50_us":356,"render_p99_us":524,"render_max_us":591,"render_worst_us":608,"benchmark_runs":3,"benchmark_iterations":1000},"status":"discard","description":"push focused Button marker as a char","timestamp":1785494671550,"segment":0,"confidence":1.6521739130434783,"asi":{"hypothesis":"Avoid formatting the focused flag in Button markers by writing only the action id and pushing '0' or '1'.","rollback_reason":"Primary render_p95_us regressed from actual best 364us to 460us.","next_action_hint":"Keep the combined write! call for the Button marker header; splitting it into more push operations hurts p95."}}
{"run":14,"commit":"8c20292","metric":375,"metrics":{"render_p50_us":352,"render_p99_us":408,"render_max_us":617,"render_worst_us":630,"benchmark_runs":3,"benchmark_iterations":1000},"status":"discard","description":"feed action globals from iterator","timestamp":1785494790939,"segment":0,"confidence":1.853658536585366,"asi":{"hypothesis":"Avoid collecting action helper functions into a BTreeMap before passing them to MiniJinja Value::from_iter.","rollback_reason":"Primary render_p95_us regressed from actual best 364us to 375us.","next_action_hint":"Keep the explicit BTreeMap; MiniJinja conversion or iterator shape is not faster in this path."}}
{"run":15,"commit":"8c20292","metric":437,"metrics":{"render_p50_us":359,"render_p99_us":566,"render_max_us":628,"render_worst_us":651,"benchmark_runs":3,"benchmark_iterations":1000},"status":"discard","description":"control rerun of current best without code changes","timestamp":1785494872052,"segment":0,"confidence":1.6521739130434783,"asi":{"hypothesis":"Measure current best again without code changes to estimate benchmark noise before accepting more tiny changes.","rollback_reason":"No code change to keep; measured p95 was worse than actual best 364us, showing high run-to-run noise.","next_action_hint":"Require larger p95 wins or repeat promising small wins before keeping benchmark-shaped changes."}}
{"run":16,"commit":"8c20292","metric":384,"metrics":{"render_p50_us":350,"render_p99_us":554,"render_max_us":622,"render_worst_us":639,"benchmark_runs":5,"benchmark_iterations":1000},"status":"discard","description":"compare printable ASCII bytes directly","timestamp":1785494974565,"segment":0,"confidence":1.853658536585366,"asi":{"hypothesis":"Replace Range::contains in the printable ASCII text_canvas check with direct byte comparisons.","rollback_reason":"Primary render_p95_us regressed from actual best 364us to 384us, and clippy flags the manual range check.","next_action_hint":"Keep the range contains form; the compiler and clippy prefer it."}}
