{"run":17,"commit":"8c20292","metric":400,"metrics":{"render_p50_us":355,"render_p99_us":511,"render_max_us":600,"render_worst_us":678,"benchmark_runs":5,"benchmark_iterations":1000},"status":"discard","description":"control rerun current best with five benchmark runs","timestamp":1785495050338,"segment":0,"confidence":1.7272727272727273,"asi":{"hypothesis":"Re-measure current best with RUNS=5 to reduce noise and calibrate future comparisons.","rollback_reason":"No code change to keep; p95 was 400us, far above the prior 364us best and close to the extension baseline.","next_action_hint":"Use RUNS=5 for larger changes but do not accept tiny wins without repeated confirmation."}}
{"run":18,"commit":"8c20292","metric":417,"metrics":{"render_p50_us":355,"render_p99_us":548,"render_max_us":611,"render_worst_us":650,"benchmark_runs":5,"benchmark_iterations":1000},"status":"discard","description":"accumulate initial flex main size while building sizes","timestamp":1785495160153,"segment":0,"confidence":1.6888888888888889,"asi":{"hypothesis":"Avoid a separate sizes.iter().sum() scan by accumulating the total while building flex child main sizes.","rollback_reason":"Primary render_p95_us regressed from actual best 364us and RUNS=5 control 400us to 417us.","next_action_hint":"The iterator collect plus sum is better optimized or clearer; avoid manual loops for this scan."}}
{"run":19,"commit":"82a2e82","metric":379,"metrics":{"render_p50_us":351,"render_p99_us":561,"render_max_us":641,"render_worst_us":644,"benchmark_runs":5,"benchmark_iterations":1000},"status":"keep","description":"write text cells through a borrowed row","timestamp":1785495259498,"segment":0,"confidence":1.7272727272727273,"asi":{"hypothesis":"Borrow each text_canvas row once and write cells through that row instead of indexing canvas.cells[y] for every cell.","checks":"cargo test -p zellij-template-render --target x86_64-unknown-linux-gnu passed","benchmark_delta_us":-21,"best_before_us":400,"comparison":"Compared against the RUNS=5 current-best control because subsequent experiments use RUNS=5 to reduce noise."}}
{"run":20,"commit":"82a2e82","metric":473,"metrics":{"render_p50_us":357,"render_p99_us":603,"render_max_us":669,"render_worst_us":720,"benchmark_runs":5,"benchmark_iterations":1000},"status":"discard","description":"hoist action option branch in ASCII text painting","timestamp":1785495361434,"segment":0,"confidence":1.6888888888888889,"asi":{"hypothesis":"Split the printable ASCII text loop into Some(action) and None branches to avoid cloning Option<A> per cell.","rollback_reason":"Primary render_p95_us regressed from RUNS=5 best 379us to 473us.","next_action_hint":"Keep the single loop; branch duplication harms optimizer behavior or instruction cache more than Option clone costs."}}
{"run":21,"commit":"82a2e82","metric":471,"metrics":{"render_p50_us":355,"render_p99_us":555,"render_max_us":1861,"render_worst_us":1954,"benchmark_runs":5,"benchmark_iterations":1000},"status":"discard","description":"control rerun of row-local text writes","timestamp":1785495448013,"segment":0,"confidence":1.52,"asi":{"hypothesis":"Re-measure current kept row-local text write change without code modifications to check stability.","rollback_reason":"No code change to keep; p95 was 471us with large max outliers, indicating environmental noise.","next_action_hint":"Look for changes with larger median and p95 wins; consider improving measurement isolation later."}}
{"run":22,"commit":"82a2e82","metric":423,"metrics":{"render_p50_us":333,"render_p99_us":482,"render_max_us":597,"render_worst_us":615,"benchmark_runs":5,"benchmark_iterations":1000},"status":"discard","description":"skip synthetic root wrapper for single top-level Flex","timestamp":1785495629385,"segment":0,"confidence":1.4901960784313726,"asi":{"hypothesis":"Avoid one layout wrapper when the rendered template has exactly one top-level Flex node, while preserving wrapper behavior for text, buttons, multiple roots, and top-level OnOverflow.","rollback_reason":"Primary render_p95_us regressed from RUNS=5 kept best 379us to 423us, despite lower p50.","next_action_hint":"Do not skip the root wrapper for p95; if revisited, add semantic tests for top-level justify, align, text, button, and multi-root behavior first."}}
{"run":23,"commit":"82a2e82","metric":392,"metrics":{"render_p50_us":354,"render_p99_us":506,"render_max_us":623,"render_worst_us":674,"benchmark_runs":5,"benchmark_iterations":1000},"status":"discard","description":"parse Flex markers without collecting fields","timestamp":1785495736340,"segment":0,"confidence":1.5833333333333333,"asi":{"hypothesis":"Parse Flex marker fields from the split iterator directly instead of collecting them into a Vec.","rollback_reason":"Primary render_p95_us regressed from RUNS=5 kept best 379us to 392us.","next_action_hint":"Do not revisit Flex field parsing unless profiling shows parse_flex_spec is hot under a less noisy benchmark."}}
{"run":24,"commit":"82a2e82","metric":523,"metrics":{"render_p50_us":349,"render_p99_us":586,"render_max_us":621,"render_worst_us":685,"benchmark_runs":5,"benchmark_iterations":1000},"status":"discard","description":"store Canvas cells in one flat vector","timestamp":1785495879176,"segment":0,"confidence":1.4901960784313726,"asi":{"hypothesis":"Replace Vec<Vec<Cell>> canvas storage with one flat Vec<Cell> to remove per-row allocations and improve locality.","rollback_reason":"Primary render_p95_us regressed from RUNS=5 kept best 379us to 523us, even though p50 improved slightly.","next_action_hint":"Do not flatten Canvas as a standalone change; row Vecs perform better for p95 and keep code simpler."}}
{"run":25,"commit":"82a2e82","metric":439,"metrics":{"render_p50_us":358,"render_p99_us":605,"render_max_us":634,"render_worst_us":678,"benchmark_runs":5,"benchmark_iterations":1000},"status":"discard","description":"mutate default ASCII cells instead of replacing them","timestamp":1785496048682,"segment":0,"confidence":1.4074074074074074,"asi":{"hypothesis":"For printable ASCII text, push the character into the existing default cell and set its action instead of constructing a new Cell.","rollback_reason":"Primary render_p95_us regressed from RUNS=5 kept best 379us to 439us.","next_action_hint":"Keep assigning a new Cell in the ASCII path; mutating existing cells is slower."}}
{"run":26,"commit":"0886003","metric":370,"metrics":{"render_p50_us":336,"render_p99_us":468,"render_max_us":597,"render_worst_us":610,"benchmark_runs":5,"benchmark_iterations":1000},"status":"keep","description":"build canvas rows without cloning a prototype row","timestamp":1785496188690,"segment":0,"confidence":1.3571428571428572,"asi":{"hypothesis":"Construct each Canvas row with resize_with(Cell::default) instead of cloning one prototype row for every row.","checks":"cargo test -p zellij-template-render --target x86_64-unknown-linux-gnu passed","benchmark_delta_us":-9,"best_before_us":379,"comparison":"Compared against the previous RUNS=5 kept best."}}
{"run":42,"commit":"24ff8ca","metric":361,"metrics":{"render_p50_us":336,"render_p99_us":419,"render_max_us":558,"render_worst_us":624,"benchmark_runs":5,"benchmark_iterations":1000},"status":"keep","description":"build canvas rows without cloning default cells","timestamp":1785496202114,"segment":0,"confidence":5.900990099009901,"asi":{"hypothesis":"Use resize_with for each Canvas row so creating blank canvases does not clone a default Cell with an empty String for every column.","checks":"cargo test -p zellij-template-render --target x86_64-unknown-linux-gnu passed","benchmark_delta_us":-18,"best_before_us":379}}
{"run":43,"commit":"24ff8ca","metric":369,"metrics":{"render_p50_us":343,"render_p99_us":559,"render_max_us":622,"render_worst_us":707,"benchmark_runs":5,"benchmark_iterations":1000},"status":"discard","description":"skip duplicate text validation for Flex leaf children","timestamp":1785496249633,"segment":0,"confidence":5.96,"asi":{"hypothesis":"Flex already calls natural_size for every child, so leaf text inside Flex can reuse that validation and skip validate_text during text_canvas painting.","rollback_reason":"Primary render_p95_us regressed from current best 361us to 369us, with worse p99/max/worst.","next_action_hint":"Do not split the text_canvas path just to skip validation; extra match/helper path costs more than the removed scan."}}
{"run":27,"commit":"0886003","metric":379,"metrics":{"render_p50_us":335,"render_p99_us":561,"render_max_us":619,"render_worst_us":690,"benchmark_runs":5,"benchmark_iterations":1000},"status":"discard","description":"return static Flex choice strings","timestamp":1785496314152,"segment":0,"confidence":1.52,"asi":{"hypothesis":"Make parse_choice return the matching static choice string instead of allocating a String for Flex direction, justify, align, and overflow markers.","rollback_reason":"Primary render_p95_us regressed from RUNS=5 best 370us to 379us.","next_action_hint":"Keep the existing String-returning parse_choice; allocation removal here did not help p95."}}
{"run":44,"commit":"24ff8ca","metric":393,"metrics":{"render_p50_us":342,"render_p99_us":453,"render_max_us":627,"render_worst_us":642,"benchmark_runs":5,"benchmark_iterations":1000},"status":"discard","description":"direct paint plain ASCII Flex leaves","timestamp":1785496334279,"segment":0,"confidence":6.208333333333333,"asi":{"hypothesis":"Plain ASCII Text and Button leaves inside Flex can paint directly into the parent canvas and skip child Canvas allocation plus blit while preserving fallback behavior for ANSI, Unicode, and multiline text.","rollback_reason":"Primary render_p95_us regressed from current best 361us to 393us despite avoiding many child canvases.","next_action_hint":"Do not use a branch-heavy direct paint path without carrying precomputed leaf flags; repeated ASCII scans and extra control flow outweigh allocation savings."}}
{"run":28,"commit":"0886003","metric":527,"metrics":{"render_p50_us":346,"render_p99_us":593,"render_max_us":2427,"render_worst_us":3764,"benchmark_runs":5,"benchmark_iterations":1000},"status":"discard","description":"build each canvas row with vec macro","timestamp":1785496412720,"segment":0,"confidence":1.3571428571428572,"asi":{"hypothesis":"Keep the one-row-at-a-time Canvas constructor but use vec![Cell::default(); width] inside each row instead of resize_with.","rollback_reason":"Primary render_p95_us regressed from RUNS=5 best 370us to 527us, with severe tail outliers.","next_action_hint":"Keep resize_with for Canvas rows; cloning Cells inside each row is worse."}}
{"run":45,"commit":"24ff8ca","metric":432,"metrics":{"render_p50_us":332,"render_p99_us":558,"render_max_us":588,"render_worst_us":598,"benchmark_runs":5,"benchmark_iterations":1000},"status":"discard","description":"move cells from local child canvases during blit","timestamp":1785496418049,"segment":0,"confidence":6.208333333333333,"asi":{"hypothesis":"Child canvases are local temporaries, so consuming them during blit can move non-empty cells into the parent instead of cloning String and action values.","rollback_reason":"Primary render_p95_us regressed from current best 361us to 432us despite a better p50.","next_action_hint":"Do not consume child canvases in blit as a standalone change; mem::take and mutable source access improve median but hurt tail latency."}}
{"run":29,"commit":"0886003","metric":457,"metrics":{"render_p50_us":346,"render_p99_us":567,"render_max_us":2758,"render_worst_us":3692,"benchmark_runs":5,"benchmark_iterations":1000},"status":"discard","description":"construct ASCII cell text with String::from char","timestamp":1785496521782,"segment":0,"confidence":1.2258064516129032,"asi":{"hypothesis":"Use String::from(char::from(byte)) instead of char::from(byte).to_string() for one-cell printable ASCII text.","rollback_reason":"Primary render_p95_us regressed from RUNS=5 best 370us to 457us, with severe tail outliers.","next_action_hint":"Keep char::to_string for ASCII cell text; constructor substitution is not useful."}}
{"run":46,"commit":"24ff8ca","metric":433,"metrics":{"render_p50_us":340,"render_p99_us":579,"render_max_us":725,"render_worst_us":1354,"benchmark_runs":5,"benchmark_iterations":1000},"status":"discard","description":"cache leaf text natural sizes in Node","timestamp":1785496606629,"segment":0,"confidence":6.408602150537634,"asi":{"hypothesis":"Store leaf natural sizes in Node with OnceCell so repeated Flex natural_size walks reuse prior text validation and width results.","rollback_reason":"Primary render_p95_us regressed from current best 361us to 433us and worst latency spiked.","next_action_hint":"Do not put OnceCell inside every leaf Node; interior mutability and larger nodes cost more than repeated small text measurement in this workload."}}
{"run":47,"commit":"24ff8ca","metric":470,"metrics":{"render_p50_us":359,"render_p99_us":610,"render_max_us":688,"render_worst_us":5220,"benchmark_runs":5,"benchmark_iterations":1000},"status":"discard","description":"store Flex child main and cross sizes in one Vec","timestamp":1785496741220,"segment":0,"confidence":6.622222222222222,"asi":{"hypothesis":"Replace separate naturals and main-size vectors in layout_flex_children with one small struct vector to reduce allocations and zips.","rollback_reason":"Primary render_p95_us regressed from current best 361us to 470us with severe worst-latency outlier.","next_action_hint":"Keep separate Vec<(width,height)> and Vec<usize>; the simpler primitive vectors optimize better than a local struct vector."}}
